### ISSUE TITLE
Repetitive A requests for cloudfare.com

### ISSUE THREAD

**Issue by MoaMoaK** [MatthewVance/unbound-docker#25]
Some process in the container is runinng regular A requests for `cloudfare.com` (every 5 seconds or so). I could not identify where it comes from but I'm sure it's not from my conf since I can reproduce it with the following:
```
$ docker run --name my-unbound -d -p 5306:53/udp mvance/unbound:latest
$ docker exec -it my-unbound apt update
$ docker exec -it my-unbound apt -y install tcpdump
$ docker exec -it my-unbound tcpdump -i any
tcpdump: verbose output suppressed, use -v or -vv for full protocol decode
listening on any, link-type LINUX_SLL (Linux cooked), capture size 262144 bytes
15:13:34.785703 IP localhost.53809 > localhost.53: 23315+ A? cloudflare.com. (32)
15:13:34.785770 IP localhost.53 > localhost.53809: 23315 2/0/0 A 198.41.214.162, A 198.41.215.162 (64)
15:13:40.200091 IP localhost.60826 > localhost.53: 61714+ A? cloudflare.com. (32)
15:13:40.200138 IP localhost.53 > localhost.60826: 61714 2/0/0 A 198.41.215.162, A 198.41.214.162 (64)
15:13:45.618711 IP localhost.45959 > localhost.53: 43194+ A? cloudflare.com. (32)
15:13:45.618766 IP localhost.53 > localhost.45959: 43194 2/0/0 A 198.41.214.162, A 198.41.215.162 (64)
15:13:51.054496 IP localhost.42114 > localhost.53: 38989+ A? cloudflare.com. (32)
15:13:51.054563 IP localhost.53 > localhost.42114: 38989 2/0/0 A 198.41.215.162, A 198.41.214.162 (64)
...
```

**Comment by MatthewVance** [comment]
It's the health check. Line 130 of Dockerfile

**Comment by MatthewVance** [comment]
Here's the commit: https://github.com/MatthewVance/unbound-docker/commit/2b5f316636e19f92e187bdf4f156914084447237

Here's the why: https://github.com/MatthewVance/stubby-docker/pull/3
